reports/research/intel/sources/strategy-library-2026-10-06/k151_toc.json

{"chapters": {"1": ["Introduction and Summary", 15], "2": ["Options", 17], "3": ["Stocks", 40], "4": ["Exchange-traded funds (ETFs)", 61], "5": ["Fixed Income", 66], "6": ["Indexes", 76], "7": ["Volatility", 80], "8": ["Foreign Exchange (FX)", 85], "9": ["Commodities", 89], "10": ["Futures", 92], "11": ["Structured Assets", 97], "12": ["Convertibles", 101], "13": ["Tax Arbitrage", 102], "14": ["Miscellaneous Assets", 104], "15": ["Distressed Assets", 108], "16": ["Real Estate", 111], "17": ["Cash", 114], "18": ["Cryptocurrencies", 116], "19": ["Global Macro", 121], "20": ["Infrastructure", 123]}, "entries": [["2.1", "Generalities", 17], ["2.2", "Strategy: Covered call", 18], ["2.3", "Strategy: Covered put", 18], ["2.4", "Strategy: Protective put", 19], ["2.5", "Strategy: Protective call", 19], ["2.6", "Strategy: Bull call spread", 19], ["2.7", "Strategy: Bull put spread", 20], ["2.8", "Strategy: Bear call spread", 20], ["2.9", "Strategy: Bear put spread", 20], ["2.10", "Strategy: Long synthetic forward", 21], ["2.11", "Strategy: Short synthetic forward", 21], ["2.12", "Strategy: Long combo", 21], ["2.13", "Strategy: Short combo", 22], ["2.14", "Strategy: Bull call ladder", 22], ["2.15", "Strategy: Bull put ladder", 23], ["2.16", "Strategy: Bear call ladder", 23], ["2.17", "Strategy: Bear put ladder", 23], ["2.18", "Strategy: Calendar call spread", 24], ["2.19", "Strategy: Calendar put spread", 24], ["2.20", "Strategy: Diagonal call spread", 25], ["2.21", "Strategy: Diagonal put spread", 25], ["2.22", "Strategy: Long straddle", 26], ["2.23", "Strategy: Long strangle", 26], ["2.24", "Strategy: Long guts", 26], ["2.25", "Strategy: Short straddle", 27], ["2.26", "Strategy: Short strangle", 27], ["2.27", "Strategy: Short guts", 27], ["2.28", "Strategy: Long call synthetic straddle", 28], ["2.29", "Strategy: Long put synthetic straddle", 28], ["2.30", "Strategy: Short call synthetic straddle", 28], ["2.31", "Strategy: Short put synthetic straddle", 29], ["2.32", "Strategy: Covered short straddle", 29], ["2.33", "Strategy: Covered short strangle", 29], ["2.34", "Strategy: Strap", 30], ["2.35", "Strategy: Strip", 30], ["2.36", "Strategy: Call ratio backspread", 30], ["2.37", "Strategy: Put ratio backspread", 31], ["2.38", "Strategy: Ratio call spread", 31], ["2.39", "Strategy: Ratio put spread", 31], ["2.40", "Strategy: Long call butterfly", 32], ["2.40.1", "Strategy: Modified call butterfly", 32], ["2.41", "Strategy: Long put butterfly", 32], ["2.41.1", "Strategy: Modified put butterfly", 33], ["2.42", "Strategy: Short call butterfly", 33], ["2.43", "Strategy: Short put butterfly", 33], ["2.44", "Strategy: “Long” iron butterfly", 34], ["2.45", "Strategy: “Short” iron butterfly", 34], ["2.46", "Strategy: Long call condor", 34], ["2.47", "Strategy: Long put condor", 35], ["2.48", "Strategy: Short call condor", 35], ["2.49", "Strategy: Short put condor", 35], ["2.50", "Strategy: Long iron condor", 36], ["2.51", "Strategy: Short iron condor", 36], ["2.52", "Strategy: Long box", 37], ["2.53", "Strategy: Collar", 37], ["2.54", "Strategy: Bullish short seagull spread", 37], ["2.55", "Strategy: Bearish long seagull spread", 38], ["2.56", "Strategy: Bearish short seagull spread", 38], ["2.57", "Strategy: Bullish long seagull spread", 39], ["3.1", "Strategy: Price-momentum", 40], ["3.2", "Strategy: Earnings-momentum", 41], ["3.3", "Strategy: Value", 42], ["3.4", "Strategy: Low-volatility anomaly", 42], ["3.5", "Strategy: Implied volatility", 43], ["3.6", "Strategy: Multifactor portfolio", 43], ["3.7", "Strategy: Residual momentum", 44], ["3.8", "Strategy: Pairs trading", 45], ["3.9", "Strategy: Mean-reversion – single cluster", 46], ["3.9.1", "Strategy: Mean-reversion – multiple clusters", 47], ["3.10", "Mean-reversion – weighted regression", 49], ["3.11", "Strategy: Single moving average", 49], ["3.12", "Strategy: Two moving averages", 50], ["3.13", "Strategy: Three moving averages", 51], ["3.14", "Strategy: Support and resistance", 51], ["3.15", "Strategy: Channel", 52], ["3.16", "Strategy: Event-driven – M&A", 52], ["3.17", "Strategy: Machine learning – single-stock KNN", 53], ["3.18", "Strategy: Statistical arbitrage – optimization", 55], ["3.18.1", "Dollar-neutrality", 56], ["3.19", "Strategy: Market-making", 58], ["3.20", "Strategy: Alpha combos", 59], ["3.21", "A few comments", 60], ["4.1", "Strategy: Sector momentum rotation", 61], ["4.1.1", "Strategy: Sector momentum rotation with MA filter", 62], ["4.1.2", "Strategy: Dual-momentum sector rotation", 62], ["4.2", "Strategy: Alpha rotation", 63], ["4.3", "Strategy: R-squared", 63], ["4.4", "Strategy: Mean-reversion", 64], ["4.5", "Strategy: Leveraged ETFs (LETFs)", 64], ["4.6", "Strategy: Multi-asset trend following", 65], ["5.1", "Generalities", 66], ["5.1.1", "Zero-coupon bonds", 66], ["5.1.2", "Bonds with coupons", 66], ["5.1.3", "Floating rate bonds", 67], ["5.1.4", "Swaps", 67], ["5.1.5", "Duration and convexity", 68], ["5.2", "Strategy: Bullets", 69], ["5.3", "Strategy: Barbells", 69], ["5.4", "Strategy: Ladders", 70], ["5.5", "Strategy: Bond immunization", 70], ["5.6", "Strategy: Dollar-duration-neutral butterfly", 71], ["5.7", "Strategy: Fifty-fifty butterfly", 72], ["5.8", "Strategy: Regression-weighted butterfly", 72], ["5.8.1", "Strategy: Maturity-weighted butterfly", 73], ["5.9", "Strategy: Low-risk factor", 73], ["5.10", "Strategy: Value factor", 73], ["5.11", "Strategy: Carry factor", 74], ["5.12", "Strategy: Rolling down the yield curve", 74], ["5.13", "Strategy: Yield curve spread (flatteners & steepeners)", 75], ["5.14", "Strategy: CDS basis arbitrage", 75], ["5.15", "Strategy: Swap-spread arbitrage", 76], ["6.1", "Generalities", 76], ["6.2", "Strategy: Cash-and-carry arbitrage", 77], ["6.3", "Strategy: Dispersion trading in equity indexes", 77], ["6.3.1", "Strategy: Dispersion trading – subset portfolio", 78], ["6.4", "Strategy: Intraday arbitrage between index ETFs", 79], ["6.5", "Strategy: Index volatility targeting with risk-free asset", 80], ["7.1", "Generalities", 80], ["7.2", "Strategy: VIX futures basis trading", 81], ["7.3", "Strategy: Volatility carry with two ETNs", 82], ["7.3.1", "Strategy: Hedging short VXX with VIX futures", 82], ["7.4", "Strategy: Volatility risk premium", 83], ["7.4.1", "Strategy: Volatility risk premium with Gamma hedging", 83], ["7.5", "Strategy: Volatility skew – long risk reversal", 84], ["7.6", "Strategy: Volatility trading with variance swaps", 84], ["8.1", "Strategy: Moving averages with HP filter", 85], ["8.2", "Strategy: Carry trade", 86], ["8.2.1", "Strategy: High-minus-low carry", 87], ["8.3", "Strategy: Dollar carry trade", 88], ["8.4", "Strategy: Momentum & carry combo", 88], ["8.5", "Strategy: FX triangular arbitrage", 89], ["9.1", "Strategy: Roll yields", 89], ["9.2", "Strategy: Trading based on hedging pressure", 90], ["9.3", "Strategy: Portfolio diversification with commodities", 90], ["9.4", "Strategy: Value", 90], ["9.5", "Strategy: Skewness premium", 91], ["9.6", "Strategy: Trading with pricing models", 91], ["10.1", "Strategy: Hedging risk with futures", 92], ["10.1.1", "Strategy: Cross-hedging", 93], ["10.1.2", "Strategy: Interest rate risk hedging", 93], ["10.2", "Strategy: Calendar spread", 94], ["10.3", "Strategy: Contrarian trading (mean-reversion)", 95], ["10.3.1", "Strategy: Contrarian trading – market activity", 95], ["10.4", "Strategy: Trend following (momentum)", 96], ["11.1", "Generalities: Collateralized Debt Obligations (CDOs)", 97], ["11.2", "Strategy: Carry, equity tranche – index hedging", 99], ["11.3", "Strategy: Carry, senior/mezzanine – index hedging", 99], ["11.4", "Strategy: Carry – tranche hedging", 99], ["11.5", "Strategy: Carry – CDS hedging", 100], ["11.6", "Strategy: CDOs – curve trades", 100], ["11.7", "Strategy: Mortgage-backed security (MBS) trading", 100], ["12.1", "Strategy: Convertible arbitrage", 101], ["12.2", "Strategy: Convertible option-adjusted spread", 102], ["13.1", "Strategy: Municipal bond tax arbitrage", 102], ["13.2", "Strategy: Cross-border tax arbitrage", 103], ["13.2.1", "Strategy: Cross-border tax arbitrage with options", 104], ["14.1", "Strategy: Inflation hedging – inflation swaps", 104], ["14.2", "Strategy: TIPS-Treasury arbitrage", 105], ["14.3", "Strategy: Weather risk – demand hedging", 106], ["14.4", "Strategy: Energy – spark spread", 108], ["15.1", "Strategy: Buying and holding distressed debt", 108], ["15.2", "Strategy: Active distressed investing", 109], ["15.2.1", "Strategy: Planning a reorganization", 109], ["15.2.2", "Strategy: Buying outstanding debt", 109], ["15.2.3", "Strategy: Loan-to-own", 110], ["15.3", "Strategy: Distress risk puzzle", 110], ["15.3.1", "Strategy: Distress risk puzzle – risk management", 110], ["16.1", "Generalities", 111], ["16.2", "Strategy: Mixed-asset diversification with real estate", 111], ["16.3", "Strategy: Intra-asset diversification within real estate", 112], ["16.3.1", "Strategy: Property type diversification", 112], ["16.3.2", "Strategy: Economic diversification", 112], ["16.3.3", "Strategy: Property type and geographic diversification", 113], ["16.4", "Strategy: Real estate momentum – regional approach", 113], ["16.5", "Strategy: Inflation hedging with real estate", 113], ["16.6", "Strategy: Fix-and-flip", 114], ["17.1", "Generalities", 114], ["17.2", "Strategy: Money laundering – the dark side of cash", 114], ["17.3", "Strategy: Liquidity management", 115], ["17.4", "Strategy: Repurchase agreement (REPO)", 115], ["17.5", "Strategy: Pawnbroking", 115], ["17.6", "Strategy: Loan sharking", 116], ["18.1", "Generalities", 116], ["18.2", "Strategy: Artificial neural network (ANN)", 116], ["18.3", "Strategy: Sentiment analysis – naı̈ve Bayes Bernoulli", 120], ["19.1", "Generalities", 121], ["19.2", "Strategy: Fundamental macro momentum", 122], ["19.3", "Strategy: Global macro inflation hedge", 122], ["19.4", "Strategy: Global fixed-income strategy", 123], ["19.5", "Strategy: Trading on economic announcements", 123]]}

reports/research/intel/sources/physics-geometry-2026-10-04/arxiv__1610.08104_bun_bouchaud_potters_fulltext.md

so that we are able to compute the Stieltjes transform of M−1 given the Stieltjes transform of M.
Blue function and R-transform. There are many other useful RMT transforms, some that will turn
out to be important in the next chapter. We begin with the free cumulant generating function
which is known as the R-transform in the literature [62, 54, 63]. To define this quantity, it is
convenient to introduce the functional inverse of the Stieltjes transform, also known as the Blue
transform [64]
                                          B(g(z)) = z,                                      (2.15)
and the R-transform is simply defined by
                                                            1
                                          R(ω) = B(ω) −       .                               (2.16)
                                                            ω
Note that one may deduce from (2.13) the following property

17
Note that the first three cumulants are equivalent to the ‘standard’ cumulants of ordinary random
variables and only differ from ` ⩾ 4. Note for example that when ϕ1 = 0, one finds κ4 = ϕ4 − 2ϕ22 ,
whereas the standard kurtosis would read ϕ4 − 3ϕ22 . It will turn out that the free cumulants of the
sum of independent – in a sense specified below – random matrices are given by the sum of the
cumulants of these random matrices, i.e. κ` (M) = κ` (A) + κ` (B), see section 2.3 below.
Moment generating function and S-transform. The moment generating function of the LSD ρ is
obtained by considering
                                                       duρ(u)u
                                                    Z
                                     .
                               T (z) .= zg(z) − 1 =            ,                       (2.21)
                                                        z−u
frequently known as the T (or sometimes η [54]) transform [39]. Indeed, by taking z → ∞, one
readily finds
                                                ∞
                                                X ϕ(Mk )
                                       TM (z) =          .                             (2.22)
                                                    zk
                                                       k=1
We can then introduce the so-called S-transform as [62]:
                                                          ω+1
                                             S(ω) ..=                                                       (2.23)
                                                         ωT −1 (ω)
where T −1 (ω) is the functional inverse of the T -transform. Using the series expansion of TM (z)
in powers of z −1 and Eq. (2.20), one finds that the S-transform also admits a Taylor series which
reads:
                                 1   ω              ω2
                SM (ω)     =       + 3 (ϕ21 − ϕ2 ) + 5 (2ϕ22 − ϕ2 ϕ21 − ϕ3 ϕ1 ) + O(ω 3 )
                                ϕ1  ϕ1              ϕ1
                                              2
                                1   κ2      2κ − κ1 κ3 2
                           =       − 3ω + 2 5          ω + O(ω 3 ).                                         (2.24)
                                κ1  κ1          κ1
From this last equation, it is not hard to see that the S-transform of a matrix M which has a zero
trace is ill-defined. Hence, the S-transform of a Wigner matrix does not make sense, but it will be
very useful when manipulating positive definite covariance matrices (see Section 2.3.3)
   Note finally that there exists a relation between the R-transform and the S-transform
                                            1                            1
                               R(ω) =             ,          S(ω) =                                         (2.25)
                                         S(ωR(ω))                     R(ωS(ω))
which allows one to deduce R(z) from S(z) and vice versa. Other properties on the R and S
transforms can be found e.g. in [65].
      Let us show the second equality of (2.25) for the sake of completeness. The derivation of the first
      identity is similar and we omit details. Using (2.16) and (2.23), one obtains
                                                                !
                                                        ω+1         T −1 (ω)
                                     R(ωS(ω)) = B        −1
                                                                  −          .                    (2.26)
                                                       T    (ω)      ω+1
      Next, by setting z = T −1 (ω), we can rewrite (2.21) as
                                              ω+1
                                                      = g T −1 (ω) .
                                                                   
                                                                                                   (2.27)
                                             T −1 (ω)
      Hence, we conclude that
                                                             1            ω
                              R(ωS(ω)) = T −1 (ω) −                =            .                (2.28)
                                                        g T −1 (ω)    g T −1 (ω)
      The conclusion then follows from (2.27).

It seems hopeless to find the eigenvalues {λi } that solve these N equations. However, we may
expect to find the LSD ρM in the limit N → ∞, corresponding to configuration of the eigenvalues
that satisfies these saddle-point equations. In the case of the one-cut assumption, the result reads
[41]:
                                                  p          p
                             g(z) = V 0 (z) − Q(z) (z − ν+ ) (z − ν− ),                       (2.31)
where ν− < ν+ denote the edges of supp[ρ] and Q(z) is also a Laurent polynomial with degree d − 1
and order `. Therefore, we see that we have d + 1 unknowns to determine, namely the coefficients of
Q(z), ν− and ν+ which are determined using the series expansion (2.12). We shall give a detailed

Let us show how to obtain (2.31). In the following we set β = 1. First, we introduce the normailzed trace of
   the resolvent g(z) in (2.30) by multiplying on both sides by N −1 (z − νi )−1 and summing over all i, which
   yields
                                    N                 N    N
                                 1 X V 0 (νi )    1 X X                  1
                                               = 2                                  .                    (2.32)
                                 N i=1 z − νi    N i=1 j=1;j6=i (z − νi )(νi − νj )

where ν− and ν+ denote the edges of supp[ρ] and Q(z) is a polynomial with degree d − 1 and this gives (2.31).